827350732;"Recursive promises";"cherry picked changes as agreed";0;0;"2021-03-10T08:35:47Z";12832603;232217563
755134515;"Learn Issues";"Future work would probably be easier with issues rathar that with text file ""problemi ideje vprasanja"".";0;1;"2020-12-02T10:14:15Z";12832603;232217563
535637210;"Domaca naloga 02";"";0;0;"2019-12-10T10:31:24Z";12832603;212811227
534849934;"Odstranil podvojeno besedo";"""morate dopolniti morate"" sem popravil v ""morate dopolniti"". ";0;0;"2019-12-09T10:56:40Z";45151812;212811227
521250627;"Popravil precedenco operatorjev";"Dvomim, da je bil ta primer mišljen kot protiprimer (ker ni tako očitno, da ne dela, za razliko od naslednjega). V leanu ima <-> manjšo prednost kot ->, na https://en.wikipedia.org/wiki/Logical_connective#Order_of_precedence uporabljajo enak vrstni red.\r\nČe se doda oklepaje pa je dokaz bolj preprost (in veljaven).";1;3;"2019-11-11T23:52:37Z";11291311;212811227
852835470;"Bump bottle from 0.12.16 to 0.12.19";"Bumps [bottle](https://github.com/bottlepy/bottle) from 0.12.16 to 0.12.19.\n<details>\n<summary>Commits</summary>\n<ul>\n<li><a href=""https://github.com/bottlepy/bottle/commit/152219818378926f20a5ee3d339118d7cf50a8f6""><code>1522198</code></a> Release of 0.12.19</li>\n<li><a href=""https://github.com/bottlepy/bottle/commit/57a2f22e0c1d2b328c4f54bf75741d74f47f1a6b""><code>57a2f22</code></a> Do not split query strings on <code>;</code> anymore.</li>\n<li><a href=""https://github.com/bottlepy/bottle/commit/2d6acef676d35611dc58ca9c3bac51789adbcce8""><code>2d6acef</code></a> Fix the Allow: header value in 405 &quot;Method not allowed.&quot; response.</li>\n<li><a href=""https://github.com/bottlepy/bottle/commit/44b9cf888c8481e0291b5343518f39713be04736""><code>44b9cf8</code></a> Fix release steps in makefile</li>\n<li><a href=""https://github.com/bottlepy/bottle/commit/1d531f79ab3f7255d872eef69ad74e3adb40acee""><code>1d531f7</code></a> Release of 0.12.18</li>\n<li><a href=""https://github.com/bottlepy/bottle/commit/6927a6bf365449ed1d423a2556c2e30210fcb678""><code>6927a6b</code></a> Update build steps in makefile</li>\n<li><a href=""https://github.com/bottlepy/bottle/commit/774e1c7bbb67b813a38a5fa215dd3949289176ef""><code>774e1c7</code></a> fix <a href=""https://github-redirect.dependabot.com/bottlepy/bottle/issues/1181"">#1181</a>: digestmod parameter is now required since Python 3.8</li>\n<li><a href=""https://github.com/bottlepy/bottle/commit/ce00d547a663a5174501988ab6b09ca2fb08eee5""><code>ce00d54</code></a> Fix: Two import-level DeprecationWarnings in 3.8</li>\n<li><a href=""https://github.com/bottlepy/bottle/commit/bdbab79254c75f1ce9175e9657d40aa4639854de""><code>bdbab79</code></a> fix <a href=""https://github-redirect.dependabot.com/bottlepy/bottle/issues/1181"">#1181</a>: digestmod parameter is now required since Python 3.8</li>\n<li><a href=""https://github.com/bottlepy/bottle/commit/099c4a2e8bb1e6e2c42056c6aef004024fbd8c7c""><code>099c4a2</code></a> <a href=""https://github-redirect.dependabot.com/bottlepy/bottle/issues/1177"">#1177</a> Bug fix of missing regex escaped back slashes</li>\n<li>Additional commits viewable in <a href=""https://github.com/bottlepy/bottle/compare/0.12.16...0.12.19"">compare view</a></li>\n</ul>\n</details>\n<br />\n\n\n[![Dependabot compatibility score](https://dependabot-badges.githubapp.com/badges/compatibility_score?dependency-name=bottle&package-manager=pip&previous-version=0.12.16&new-version=0.12.19)](https://docs.github.com/en/github/managing-security-vulnerabilities/about-dependabot-security-updates#about-compatibility-scores)\n\nDependabot will resolve any conflicts with this PR as long as you don\'t alter it yourself. You can also trigger a rebase manually by commenting `@dependabot rebase`.\n\n[//]: # (dependabot-automerge-start)\n[//]: # (dependabot-automerge-end)\n\n---\n\n<details>\n<summary>Dependabot commands and options</summary>\n<br />\n\nYou can trigger Dependabot actions by commenting on this PR:\n- `@dependabot rebase` will rebase this PR\n- `@dependabot recreate` will recreate this PR, overwriting any edits that have been made to it\n- `@dependabot merge` will merge this PR after your CI passes on it\n- `@dependabot squash and merge` will squash and merge this PR after your CI passes on it\n- `@dependabot cancel merge` will cancel a previously requested merge and block automerging\n- `@dependabot reopen` will reopen this PR if it is closed\n- `@dependabot close` will close this PR and stop Dependabot recreating it. You can achieve the same result by closing it manually\n- `@dependabot ignore this major version` will close this PR and stop Dependabot creating any more for this major version (unless you reopen the PR or upgrade to it yourself)\n- `@dependabot ignore this minor version` will close this PR and stop Dependabot creating any more for this minor version (unless you reopen the PR or upgrade to it yourself)\n- `@dependabot ignore this dependency` will close this PR and stop Dependabot creating any more for this dependency (unless you reopen the PR or upgrade to it yourself)\n- `@dependabot use these labels` will set the current labels as the default for future PRs for this repo and language\n- `@dependabot use these reviewers` will set the current reviewers as the default for future PRs for this repo and language\n- `@dependabot use these assignees` will set the current assignees as the default for future PRs for this repo and language\n- `@dependabot use this milestone` will set the current milestone as the default for future PRs for this repo and language\n\nYou can disable automated security fix PRs for this repo from the [Security Alerts page](https://github.com/matijapretnar/uvprasalnik/network/alerts).\n\n</details>";1;0;"2021-04-07T21:33:12Z";49699333;190700621
1169980071;"Popravljena dva typota";"Ravno se učim uporabljati git, popravil sem **dve slovnični napaki** (oz. tipkarska škrata ali kako se že reče). Pa ker je tako majhna sprememba, nisem novega brancha delal.";0;1;"2022-03-15T17:34:03Z";59563351;52275510
832737930;"Popravljena funkcija pot_od_prazne_besede, dodana dokumentacija. ";"`pot_od_prazne_besede` sedaj vrne vse možne poti od praznega niza do želene besede, ne samo možnosti, kjer se znaki dodajajo po vrsti od prvega do zadnjega. \r\n\r\nDodana dokumentacija za nove funkcije, ter type hinting za vse funkcije. ";0;1;"2021-03-16T12:16:54Z";26526085;52275510
655755990;"V proracunovodji manjka mapa uporabniki";"Če repozitorij kloniraš in zaženeš `proracunovodja/spletni_vmesnik.py`, se program sesuje z napako\r\n**[Errno 2] No such file or directory: 'uporabniki'**\r\n";0;1;"2020-07-13T10:55:34Z";38475173;52275510
298648297;"Dve napakici";"Sem opazil in popravil dve malenkosti.";0;2;"2018-02-20T15:58:39Z";6708236;52275510
1113892486;"Dodani testni primeri";"Dodani računalniško zgenerirani testni primeri. Dodal sem še nekaj rešitev sudokujev, ki so manjkale (običajni 10-17).";0;1;"2022-01-25T13:30:41Z";77148745;43541611
1097013954;"Popravljen sudoku s termometri";"Iz vira ni bila prepisana 7 v 3. vrstici, zaradi česar je imel sudoku 2 rešitvi.";0;1;"2022-01-08T19:15:11Z";77148745;43541611
1093745559;"Dn";"";0;3;"2022-01-04T20:54:58Z";82776305;43541611
1090111992;"Dodaj \n na konec 1. datoteke v vsaki seriji testov";"Preostale testne datoteke se vse koncajo pravilno";0;0;"2021-12-28T20:25:12Z";15659253;43541611
1089570594;"Popravi manjše napake v navodilih";"";0;1;"2021-12-28T02:39:48Z";15659253;43541611
1045642891;"Pobriši rec iz funkcij, ki niso rekurzije";"";1;0;"2021-11-05T09:52:49Z";13329220;43541611
1045637924;"Niso vse funkcije rekurzivne";"Popravek uvodnih vaj iz Ocamla";0;0;"2021-11-05T09:47:06Z";13329220;43541611
1007954572;"Popravljena napačna definicija operatorja '+'";"Operator `+` števil v Pythonu ne množi, ampak jih sešteva. ";0;0;"2021-09-27T10:07:54Z";26526085;43541611
807791863;"popravek napake";"V tabeli, ki predstavlja pomnilnik za pythonov seznam s = [6, 2, 4] je vrstni red števil 11 in 29 zamenjan.";0;0;"2021-02-13T17:32:27Z";64791959;43541611
789242702;"Več možnosti, kako lahko pokvarimo AVL drevo";"Mislim, da manjkata dve možnosti, kako lahko drevo pokvarimo.\r\nČe ima levo višino h in desno h + 2, ne vidim razloga, da bi imeli poddrevesi desnega višini h + 1 in h. Lahko se zgodi tudi primer, ko imata višini h + 1 in h - 1. Enak postopek uravnoteženja deluje tudi v teh primerih.";0;4;"2021-01-19T18:07:26Z";61329240;43541611
788937229;"popravek";"";0;0;"2021-01-19T11:19:46Z";64838916;43541611
753342754;"Popravi Docker container build";"Odkomentiral sem build reference v `devcontainer.json`, da se zažene lokalen Dockerfile seutp in dodal instruction da se naložita utop in ocamlformatter.";0;4;"2020-11-30T10:12:37Z";3924224;43541611
743315432;"Popravek rešitev";"V zadnji nalogi pri uvod.ml je bila uporabljena funkcija delete, čeprav smo jo prej definirali kot remove. Program se je torej sesul.\r\n(to da github ne dovoli pull requesta za točno določene comitte je grozno)";0;4;"2020-11-15T18:29:28Z";49908672;43541611
739102477;"Pull request branch";"Popravil rešitev zadnje naloge pri vajah iz uvoda v Ocaml";0;3;"2020-11-09T15:01:06Z";49908672;43541611
729103565;"Merge";"";0;2;"2020-10-25T20:13:47Z";65187879;43541611
720575268;"Dodal vzorca \b in \B, ter odstranil podvojeno vrstico metode findall.";"";0;1;"2020-10-13T17:25:00Z";49908672;43541611
489874274;"Tiskarska napaka";"V dokazu se nekajkrat pojavi neznan y, namesto x.";0;0;"2019-09-05T16:35:04Z";42772549;43541611
291431511;"Fixed some errors";"Fixed some translation errors, and a few recursive functions were missing.";0;1;"2018-01-25T02:41:22Z";28565741;43541611
290264061;"Update dinamicno.py";"";0;4;"2018-01-21T11:01:59Z";13104460;43541611
290193906;"Stolpi";"V datoteki dinamicno.py (programiranje-1/12-dinamicno-programiranje/predavanja/dinamicno.py), se program stolpi(n) ""zacikla"". Za robni pogoj ni dovolj dati n == 0 ker ga v nekaterih primerih preskoči in gre v negativna števila. Sam sem robne primere spremenil v \r\n    if n == 0:\r\n        return 1\r\n    elif n < 0:\r\n        return 0\r\nin program deluje pravilno.";0;1;"2018-01-20T13:54:38Z";13104460;43541611
282648922;" popravil napako";"Namesto 6 bi tam morala biti 5";0;0;"2017-12-16T20:37:00Z";26307243;43541611
249770911;"Update 5-pravilnost-programov.html";"Popravil + v ++";0;0;"2017-08-11T23:33:28Z";21012823;43541611
171024446;"Update Euler.hs";"Pri euler2, vrstica 26, zamenjal 'večjih' z 'manjših'.\n";0;0;"2016-08-13T19:50:02Z";21012823;43541611
127666795;"takewhile /= takeWhile";"takewhile /= takeWhile\n\nPredlagam, da sprejmete navedeni popravek. :)\n\nLp Norma\n";0;0;"2016-01-20T11:54:24Z";13226015;43541611
119023060;"Update 5-razredi-tipov.html";"Popravek da ne bo prikazalo nepotrebnih znakov na koncu.\n";0;0;"2015-11-26T11:09:19Z";15422265;43541611
270918237;"Add proofs for ""No value restriction is needed for algebraic effects and handlers""";"Add Twelf proofs given in https://ora.ox.ac.uk/objects/uuid:ab54ef8d-373e-448b-8466-dbb12e6b644e";0;0;"2017-11-03T09:28:25Z";1502128;14789114
199535759;"Formatiranje ne dela";"Verzija, kje trenutno na spletni strani, Mathematica 10.0.2.0, ko poženem `SestaviNaloge`, pri *nekaterih* študentih (ne vseh) dobim ""rdeč kvadrat"", ki ga povzroča napaka v formatiranju:\r\n\r\n    The specified setting for the option GridBoxOptions, RowAlignments cannot be used.\r\n";0;2;"2017-01-09T11:59:13Z";646599;4430155
1157810903;"Grammars for articulating effects, for state machines with strongly typed transitions";"Hi, I'm not familiar with the literature, and my naive searches lead to nothing so far. This may not be a new idea, if it's been experimented with I'd love get pointers. This may also be off base...\r\n\r\nA natural extension of typed effects would be to let users articulate grammars. E.G. for file operations, with a RegExp-like syntax, `Open(Read|Write)*Close` would prevent one from writing to a file that hasn't been opened yet (I know there are better ways to enforce this, this is for the sake of the example).\r\n\r\nThis would enable one to ensure at compile time that a piece of code respects a given protocol (e.g. that you can't write HTTP headers while the body is being sent).";1;1;"2022-03-02T23:48:50Z";54515;3625723
1114386218;"Param variance";"";1;0;"2022-01-25T21:35:41Z";6787313;3625723
1096727902;"Clean up inference engine";"";0;0;"2022-01-07T22:39:18Z";1502128;3625723
1037334932;"JSON database implementation and conversions";"Does EFF support for JSON conversions. This includes converting files/strings/classes to dictionaries; and dictionaries to json formatted strings ?";0;3;"2021-10-27T12:02:16Z";74971701;3625723
978536102;"Add JavaScript backend.";"Compile the code to JavaScript using the `--compile-js` option.";1;0;"2021-08-24T22:33:16Z";6898398;3625723
806370202;"Replace externals with a more robust implementation";"I replaced externals with something that is more robust to future additions and alternative backends. @zigaLuksic - the only thing that is missing is `_ocaml_tophandler` and `failwith` because they are not standard builtins. Would you be so kind and take a look at how to incorporate them best? Thanks!";0;8;"2021-02-11T13:03:02Z";1502128;3625723
784402672;"Remove top-let computations";"Having top-let definitions limited to expressions makes the system much simpler (especially down the road) but at a cost of a slight inconvenience for the user. In particular, some computations need to be defined as thunks (see modified examples). What are your thoughts on the simplification?";0;6;"2021-01-12T16:44:55Z";1502128;3625723
771469688;"Gh tests";"Added github action to test for correct formatting and runs dune tests.\r\n\r\nOcamlformat version is pinned in `dune-project`, as changes in version produce different resulting files.";0;0;"2020-12-19T22:44:38Z";6787313;3625723
770892295;"J o osko patch 1";"";0;0;"2020-12-18T13:36:39Z";6787313;3625723
769742045;"Dune tests";"Ported old regression tests to dune\r\n\r\nEach file to be tested comes with two dune rules, one for invocation and one that aliases it to `dune runtest`. Rules are autogenerated by `generate_dune_rules.ml` and saved in file `dune.inc`.\r\n\r\nRun tests with:\r\n`make test` or `dune runtest`\r\n\r\nTo add new test case to existing test folders:\r\n- Create test file `text_xyz.eff` and reference file `text_xyz.eff.ref`\r\n- Run `dune runtest` to generate updated `dune.inc` file and `dune promote` to update it\r\n\r\n\r\nTo create a new folder with tests\r\n- Create new folder somewhere under `tests`\r\n- Copy `dune` file from existing test folders and add empty `dune.inc` file. Fix path to `generate_dune_rules` and adjust configurations for new test generation. You can only configure expected exit code for now.\r\n- Add test cases";0;0;"2020-12-17T09:14:14Z";6787313;3625723
623068308;"Exception handler semantics regarding multi-shot";"I'm having a hard time to figuring out, in case the computation is spawning multiple threads, what should happen when one or more of those threads is throwing an exception? If the exception handler is provided after the fork, that feels quite normal, but if the exception handler is provided before the fork, should the thrown exceptions trigger multi-shots of the exception handler ?\r\n\r\nI kinda see traditional wisdom is to prevent exceptions from crossing fork boundaries, but that seems guilty for [go statement considered harmful](https://vorpus.org/blog/notes-on-structured-concurrency-or-go-statement-considered-harmful/#go-statement-considered-harmful).\r\n\r\nI wonder how this is reasoned with algebraic effects based exception handling, some clue please ?\r\n\r\nBtw I don't know either if a `finally` block can be implemented as an effect, and if it can be implemented, I feel it even more subtle to have a multi-shot `finally` block.\r\n\r\nOn the other hand, I feel the said `goto` semantic of `go` statement can be fixed if exceptions can cross fork boundaries and properly settled.\r\n";0;6;"2020-05-22T09:08:43Z";15646573;3625723
619758274;"To imitate algebraic effects with an procedural, interpreted language";"I'd like to have your comment about how much I can imitate algebraic effects with an imperative, interpreted language.\r\n\r\nCurrently in my mind is a `perform` keyword, prefixing to an expression, so if I resolve function (or procedure, more precise for a procedural language) calls in it, against the call stack, instead of the lexical context of the direct enclosing function/procedure, I kinda feel it implements a sort of algebraic effect call, given the language having pattern matching feature for a calling-site, to dispatch or propagate (to outer frames on the call stack) the effect call.\r\n\r\nWhat's your comment about this idea?\r\n";0;11;"2020-05-17T17:34:26Z";15646573;3625723
522203357;"SimpleInfer cleanup";"";0;0;"2019-11-13T12:52:41Z";6787313;3625723
455438745;"Separation of translation and compiling";"";0;1;"2019-06-12T21:46:03Z";6898398;3625723
437759185;"Bugfixes";"Some bugfixes:\r\n\r\n- codegen/optimize.ml:\r\n  - A handler was reduced when it has no effect clauses in reduce_comp\r\n  - Unnecessary dirt set intersection in is_relatively_pure\r\n\r\n- main/shell.ml: namechanges for clarity and a bug that executed commands in reverse order, what lead to user-defined effects not being found\r\n\r\nWith a test script that checks compiled code.";0;0;"2019-04-26T16:51:06Z";9866094;3625723
435101957;"Better pervasives loading, naming of files, and ocaml format";"Eff now loads the correct pervasives for the backend that it is using.\r\n\r\nRemoved flags `--pervasives <filename>`,  `-n` and `--no-types` because they were useless.\r\n\r\nRenamed files for the Multicore Ocaml backend from the prefix `mcoc` to `multicore`.\r\n\r\nUsed `ocamlformat` and rebuilt `jseff.js`.";0;0;"2019-04-19T08:49:42Z";31988337;3625723
423221698;"Broken online tutorial";"The  interpreter at https://www.eff-lang.org/try/ displays:\r\n```\r\nRuntime error: unknown external symbol infinity.\r\n```\r\nthis makes it impossible to run  any of the code in the tutorial.";0;1;"2019-03-20T12:20:38Z";4848178;3625723
422975686;"Change clone URLs to https";"Prevents this error while pulling the repo:\r\n\r\n\r\n```sh\r\nopam pin add -k git eff git@github.com:matijapretnar/eff.git\r\n\r\nPackage eff does not exist, create as a NEW package? [Y/n] Y\r\nProcessing: [eff.~dev: git]The authenticity of host \'github.com (192.30.253.112)\' can\'t be established.\r\nRSA key fingerprint is SHA256:nThbg6kXUpJWGl7E1IGOCspRomTxdCARLviKw6E5SY8.\r\nAre you sure you want to continue connecting (yes/no)? yes\r\n[ERROR] Could not synchronize /Users/james.kraus/.opam/system/.opam-switch/sources/eff from ""git+ssh://git@github.com/matijapretnar/eff.git"":\r\n        ""/usr/bin/git fetch -q"" exited with code 128\r\n[ERROR] Error getting source from git+ssh://git@github.com/matijapretnar/eff.git:\r\n          - git+ssh://git@github.com/matijapretnar/eff.git\r\n```";0;1;"2019-03-19T22:06:17Z";415057;3625723
421455026;"added SkelTuple to apply_sub_skel in unification";"Added pattern match case";0;0;"2019-03-15T10:39:25Z";9866094;3625723
421075189;"Add support for sqrt function";"I needed it for the Box-Muller transform";0;0;"2019-03-14T15:08:14Z";536511;3625723
420469504;"Add mli, move to Symbol and fix type shadowing";"There are three main things in this pull request (in order of commits that fix them):\r\n\r\n- Added `.mli` files to most files and got rid of `oldUtils.ml` by inlining unique functions, moving important ones to `coreUtils.ml` and moving important type stuff to `coreTypes.ml`.\r\n\r\n- Eff still used `string` for things like type names and field names, so I have completed the move to `Symbol`.\r\n\r\n- Eff allowed shadowing of types, so `type a = int;; let (x : a) = 1;; type a = empty;;` produced a value of type `a` which was the `empty` type. Fixed that, wrote tests. \r\n\r\n(And then added some more tests for `pervasives.ml` and copied the new version into `docs/try`)\r\n";0;0;"2019-03-13T12:19:09Z";31988337;3625723
418186910;"Improved Pervasives";"I extended the language with additional external constants:\r\n\r\n- infinity, neg_infinity\r\n- nan\r\n\r\nand functions:\r\n\r\n- log1p, expm1\r\n- cos, sin, tan\r\n- acos, asin, atan\r\n\r\nI also cleaned up _pervasives.ml_ a bit to improve readability.";0;0;"2019-03-07T08:34:50Z";31988337;3625723
382794836;"WIP Merge in progress, tests fail, file compilation is not working";"";0;0;"2018-11-20T18:30:39Z";6787313;3625723
378150005;"Proxy assoc functions to OCaml stdlib?";"https://github.com/matijapretnar/eff/blob/4c6bc57f7a9cf5a5c57aa0cfe8bfc82a55377cc2/src/utils/assoc.ml#L7\r\n\r\nMany of the functions in `assoc.ml` can be proxied to OCaml stdlib:\r\n\r\n* `Assoc.lookup` => `List.assoc_opt`\r\n* `Assoc.remove` => `List.remove_assoc`\r\n* `Assoc.iter` => `List.iter` (has been done)\r\n* `Assoc.kmap` => `List.map`\r\n* `Assoc.fold_left` => `List.fold_left` (has been done)\r\n* `Assoc.fold_right` => `List.fold_right` (has been done)\r\n* `Assoc.length` => `List.length` (has been done)\r\n\r\nand so on. Is there a reason these are re-implemented by hand?";1;1;"2018-11-07T05:41:46Z";401167;3625723
345444873;"Loaded code and code displayed are different?";"In the Non-determinism example on the website, the backtrack handler code is written like this\r\n```ocaml\r\nlet backtrack = handler\r\n  | effect Decide k ->\r\n    (* We use a second handler to handle the continuation. *)\r\n    handle continue k false with\r\n    | effect Fail _ -> continue k true\r\n;;\r\n```\r\n\r\nHowever, it seems to me, that the paper defines it like follows\r\n```ocaml\r\nlet backtrack = handler\r\n  | effect Decide k ->\r\n    (* We use a second handler to handle the continuation. *)\r\n    handle continue k true with\r\n    | effect Fail _ -> continue k false\r\n;;\r\n```\r\n\r\n_Notice that the continuations are reversed_\r\n\r\nWhen I try loading the code in the REPL, the handler behaves correctly (I believe), even though the code shown above the REPL is wrong.\r\n\r\nI am not sure whether this is a misunderstanding on my side or a bug, but I would be appreciative if someone could take a look at it.";0;2;"2018-07-28T12:28:49Z";4943250;3625723
330082644;"return a list from external.ml";"``` .ml\r\n\r\ntype value =\r\n  | Const of Const.t\r\n  | Tuple of value list\r\n  | Record of (OldUtils.field, value) Assoc.t\r\n  | Variant of OldUtils.label * value option\r\n  | Closure of closure\r\n  | Handler of (result -> result)\r\n```\r\n\r\nI was trying to use Split as an external function \r\nI got it to work but the return value is of this type (Tuple of value list)\r\nHowever, I want to return a string list instead of tuple\r\n\r\nI tried to make a new constructor for lists but still the value retuned comes as a tuple\r\n\r\n``` .ml\r\n\r\ntype value =\r\n  | Const of Const.t\r\n  | Tuple of value list\r\n  | List of value list\r\n  | Record of (OldUtils.field, value) Assoc.t\r\n  | Variant of OldUtils.label * value option\r\n  | Closure of closure\r\n  | Handler of (result -> result)\r\n```\r\n\r\nAny ideas? \r\n\r\nThanks,\r\nGhadeer\r\n";0;12;"2018-06-07T01:07:01Z";18218390;3625723
329018291;"Type annotation";"Adds type annotations `(x : 'a)` similar to those in ocaml.\r\nThis should make writing more complex eff code easier.";0;0;"2018-06-04T11:36:50Z";31988337;3625723
327501646;"Incorrect display of lists in online version";"If you enter a list such as `[1; 2; 3]`, the closing bracket is missing. Things get weirder with nested lists. The problem seems to lie in the color formatting syntax of jQuery terminal.";0;2;"2018-05-29T21:55:30Z";1502128;3625723
326161509;"The rest of cleanup";"This concludes my effort of cleaning up Eff code for now.\r\nThe type-system files may receive a more thorough cleaning at some later point.";0;0;"2018-05-24T14:58:13Z";31988337;3625723
325822559;"Question about algebraic handler";"reddit thread:\r\nhttps://www.reddit.com/r/haskell/comments/8ldmwu/question_about_algebraic_handler/\r\n\r\nso I have the following code, and it expectingly fail, but is runtime failure\r\n\r\n```\r\neffect Fail : empty   (* This is equivalent to the type unit -> empty. *)\r\neffect Decide : bool\r\n \r\nlet fail () = absurd (perform Fail) (* Equivalent to perform (Fail ()). *)\r\nlet decide () = perform Decide\r\nlet const x y = x\r\n;;\r\n \r\nlet hfail = handler\r\n    | x -> Some x\r\n    | effect Fail k -> None\r\n \r\nlet hdecide = handler\r\n    | x -> (fun b -> if b then x else x)\r\n    | effect Decide k -> (fun s -> continue k s s)\r\n;;\r\n \r\nlet res = with hdecide handle with hfail handle\r\n    let x = decide () in\r\n    if x then fail () else 10\r\nin res false\r\n;;\r\n \r\nlet res = with hfail handle with hdecide handle\r\n    let x = decide () in\r\n    if x then fail () else 10\r\nin\r\nmatch res with\r\n| Some x -> x true\r\n| None -> 100\r\n;;\r\n```\r\n\r\n`let x = fail ()` also fail, but according to the paper it could be cought.\r\nwhat about the above large piece of code?";0;4;"2018-05-23T18:27:14Z";3397377;3625723
325669756;"Improve location annotation notation by opening CoreUtils.";"`CoreUtils` are now opened which greatly improves readability.";0;0;"2018-05-23T11:48:38Z";31988337;3625723
