325634037;"Location annotation fix";"This changes all pairs `'term * Location.t` to `'term CoreUtils.located`.\r\nThe change is necessary for consistency, however currently most files use helper functions `add_loc`, `loc_of` and `term_of` defined at the begining of the file because using `t.CoreUtils.it` makes code unreadable.\r\n\r\nPerhaps a possible solution would be to have a module `Located` which would be opened at the beginning of files?\r\n\r\nI would prefer suggestions on how to fix readability before we actually include this pull request. ";0;0;"2018-05-23T09:58:47Z";31988337;3625723
325222383;"Location annotations in SugaredSyntax";"We should use records like in `UntypedSyntax` instead of pairs.";0;0;"2018-05-22T09:58:12Z";1502128;3625723
324384174;"Assoc module";"I separated all the association list functions into a separate module and adapted the code to it.\r\nThis will hopefully encourage cleaner code and help detect more errors, however most of the files have only been adapted.";0;1;"2018-05-18T12:04:31Z";31988337;3625723
322839599;"Desugar cleanup";"I tried to improve the readability of the code by using more descriptive names and notations.\r\nAll the tests go through and almost all changes are purely aesthetic.";0;0;"2018-05-14T14:23:54Z";31988337;3625723
322333012;"Problem with the let binding.";"While cleaning up the desugaring I had some trouble with the way the variables interact in the let case.\r\nTurns out there is a problem:\r\n\r\n`let a = 1\r\nand b = a + 1\r\nin\r\nb`\r\n\r\nThe above code complains about not knowing the variable `a` in the second part. \r\n\r\nAlso, using `fold_right` seems like an odd choice to me, as the following complains about not knowing the variable `a` first:\r\n\r\n`let x = 1 and y = x + 1 and a = 1 and b = a + 1` \r\n\r\nI tried switching it to `fold_left` but with no success.";0;1;"2018-05-11T15:11:55Z";31988337;3625723
317547794;"Add floating point natural logarithms and exponentials";"";0;0;"2018-04-25T09:28:43Z";536511;3625723
317379823;"Update instructions for opam install";"";0;1;"2018-04-24T20:19:59Z";410484;3625723
317347791;"Typo in error message";"```\r\nThis expression has a forbidden cylclic type\r\n```\r\ncylclic -> cyclic\r\n\r\nin:\r\n\r\nsrc/typing/simple/simpleUnify.ml line 14";0;0;"2018-04-24T18:40:29Z";536511;3625723
317342406;"Probability example is broken";"Go to the [Try Eff](http://www.eff-lang.org/try/) page.\r\nGo to the Probability example\r\nHit ""Load File""\r\n\r\nExpected behaviour: file loads successfully.\r\nActual behaviour:\r\n```\r\nWarning (line 11, char 19):\r\nThis pattern-matching is not exhaustive.\r\n                                    Here is an example of a value that is not matched:\r\nval uniform : \'a list -> \'a = <fun>\r\nTyping error (line 22, char 16):\r\nUnbound operation Random_float\r\n# \r\n \r\n```";0;1;"2018-04-24T18:25:05Z";536511;3625723
315941040;"Files to support merlin and Emacs.";"";0;0;"2018-04-19T15:59:48Z";646599;3625723
311852702;"Using Char";"Hello all,\r\n\r\nI am having an issue with using Characters in Eff\r\nWhenever I use it, it says ""unrecognised symbol"" or ""parser error""\r\n\r\nThe main reason why I want to use it is to be able to use the **Split** function from OCaml\r\n\r\n```.ml\r\nexternal split_on_char : char -> string -> string list = ""split_on_char""\r\n\r\n```\r\n\r\nI did everything to add Char as a type and it compiled << you can see that in my Pull-request\r\nbut I noticed that it cannot parse Char properly  << maybe the single quote is the problem\r\n\r\n\r\n```.ml\r\nlet m = \'4\';;\r\nlet k = \'s\' ;;\r\n\r\n```\r\n\r\n";1;4;"2018-04-06T05:32:26Z";18218390;3625723
311849870;"Eff compilation error";"Hello all, \r\n\r\nAre there new instructions for compilation? \r\n\r\nI am having some compilation errors \r\n\r\n```make\r\n\r\nocaml setup.ml -build \r\n+ ocamlfind ocamlopt -package unix -package ocamlbuild -linkpkg -package js_of_ocaml.ocamlbuild myocamlbuild.ml /usr/local/Cellar/ocamlbuild/0.12.0/lib/ocamlbuild/ocamlbuild.cmx -o myocamlbuild\r\nocamlfind: Package `js_of_ocaml.ocamlbuild\' not found\r\nCommand exited with code 2.\r\nCompilation unsuccessful after building 1 target (0 cached) in 00:00:00.\r\nE: Failure(""Command \'\'/usr/local/bin/ocamlbuild\' src/eff.native -use-ocamlfind -plugin-tags \'package(js_of_ocaml.ocamlbuild)\' -tag debug\' terminated with error code 10"")\r\nmake: *** [build] Error 1\r\n```";0;4;"2018-04-06T05:11:42Z";18218390;3625723
311536995;"Tell advanced users that they can skip the syntax tutorial.";"";0;0;"2018-04-05T09:31:39Z";646599;3625723
305289050;"filesystem functions";"I think these are the warnings associated with my changes \r\n\r\n`+ /usr/local/bin/ocamlfind ocamlopt -c -g -annot -bin-annot -I src/typing -I src -I src/utils -I src/runtime -I src/parsing -o src/typing/exhaust.cmx src/typing/exhaust.ml\r\nFile ""src/typing/exhaust.ml"", line 93, characters 22-231:\r\nWarning 8: this pattern-matching is not exhaustive.\r\nHere is an example of a case that is not matched:\r\n(In_channel _|Out_channel _)\r\nFile ""src/typing/exhaust.ml"", line 99, characters 21-261:\r\nWarning 8: this pattern-matching is not exhaustive.\r\nHere is an example of a case that is not matched:\r\n(In_channel _|Out_channel _)`\r\n\r\nI am sorry I did not get to fix them \r\nI added an example of using files in the examples directory \r\n\r\nI also would not forget to mention that this work is adapted from what **zigaLuksic** helped me with. The read_file effect is written by him\r\n\r\nThanks, \r\nGhadeer ";1;0;"2018-03-14T18:59:41Z";18218390;3625723
298392857;"file system";"Hello all! \r\n\r\nThank you in advance for any help! \r\n\r\nI was wondering whether or not it is possible to read and write to files in Eff?\r\n\r\n";1;17;"2018-02-19T20:27:11Z";18218390;3625723
290530578;"Pre defined types and effects";"Hello all, \r\n\r\nIs there a way I can get the pre-defined types and operations?\r\n\r\nFor example,\r\nFor lists, is there a library for lists that I can import easily or I do I have to copy any definition I need into my file?\r\n\r\nI am now struggling with **Ref type** \r\n\r\n";0;2;"2018-01-22T16:34:11Z";18218390;3625723
283357125;"What is the syntax for returning a tuple ";"I am trying to do an effect that returns a tuple \r\nbut I am not able to figure out the syntax \r\n\r\n`effect Choice : unit -> (string, bool);;\r\n`\r\nPreviously, I had something like \r\n\r\n```\r\ntype 'a choice = effect\r\n  operation findChoice : unit -> 'a\r\nend;;\r\n```\r\n\r\nbut with the new syntax, I am not able to pass 'a \r\n\r\nI appreciate your help \r\n\r\nThanks, \r\n";0;2;"2017-12-19T20:20:07Z";18218390;3625723
282404816;"Make syntax compatible with Multicore OCaml";"Ignoring 372 variants (see #30) of Eff floating around, both Eff and Multicore OCaml both offer algebraic effects and handlers with slightly different syntax. I guess there is no syntax so brilliant that it would outweigh the convenience of just taking one source code and putting it into the other language. Since Multicore OCaml is the bigger one here, I suggest Eff adopts their syntax. The necessary changes are\r\n\r\n- [x] declare operations with `effect Eff : ...` - we did this some time ago\r\n- [x] call operations with `perform (Eff x)` rather than `#Eff x` - in the long run, we'd also want `perform EffWithNoArgs` and need the type `'a eff`, but in the short run, this just needs some slight changes in the parser\r\n- [x] resume continuations with `continue k x` rather than `k x` - I don't want to make a distinction between functions and continuations, so I suggest to define `continue` as the identity function\r\n- [x] define handling clauses inside a match statement\r\n\r\nI don't know whether to keep the old syntax for handlers or not, but maybe I'd issue a warning if it is used as it will make the code incompatible with Multicore OCaml. I would do the same if someone forgot to write `continue` when resuming the continuation. There will always be incompatibilities because OCaml offers so much other stuff, but at least this will give us some guarantees for small effectful examples.\r\n\r\n@kayceesrk, @lpw25 - What do you think and did I miss anything?";0;5;"2017-12-15T11:52:33Z";1502128;3625723
280716188;"Improved examples";"All of the working examples updated to 4.0, most with added commentary and expanded variable names to increase readability and ease understanding.\r\n\r\nDeleted some non-working and boring examples, and slightly restructured some others.\r\n\r\n";0;0;"2017-12-09T12:40:05Z";31988337;3625723
276595298;"Simple type system";"Closes #11, #16 and #28 ";0;0;"2017-11-24T11:51:02Z";1502128;3625723
275003027;"Default effects";"Adds basic default effects. They are implemented in the eval.ml file in a simple way that seems to work.\r\nSwitching between types was slightly improvised by looking at the rest of the code. All the type information is in the pervasives.eff file.\r\n\r\nAlso adds throwing an error when trying to define an effect with a name already in use.\r\nLooking through the files the 'add_effect' is only used in the shell, so i used Error.runtime.";0;1;"2017-11-17T21:33:51Z";31988337;3625723
274143705;"A list of Eff versions";"There are a number of Eff versions floating around. The homepage should contain a list of all versions, short description of their differences, and corresponding research papers.";0;0;"2017-11-15T12:45:05Z";1502128;3625723
274142450;"Online toplevel";"We are no longer able to compile the current `js_of_ocaml` toplevel. Let's replace it with a new one, preferrably built with Bucklescript.";0;2;"2017-11-15T12:40:32Z";1502128;3625723
274142049;"Simple type system";"The current effect system does sort of work, but has a lot of issues: #11, #16. Until the work on #27 is completed, we should use the old type system with no effect information. It is boring, but it works.";0;1;"2017-11-15T12:39:05Z";1502128;3625723
274141483;"Explicit effect subtyping";"This is the placeholder for the eventual merge of the work done on the explicitly typed intermediate language.";0;1;"2017-11-15T12:36:51Z";1502128;3625723
274140705;"Add resources for built-in effects";"When throwing away instances, resources for built-in effects got thrown away as well. We should add at least the one for print to be able to write interesting examples.";0;0;"2017-11-15T12:33:49Z";1502128;3625723
273133328;"Compile error when installing with OPAM";"I get the following error when attempting to install Eff via OPAM on macOS.\r\n\r\n~~~\r\n# File ""src/parsing/lexer.mll"", line 62, characters 36-37:\r\n# Error: This expression has type string but an expression was expected of type\r\n#          bytes\r\n# Command exited with code 2.\r\n### stderr ###\r\n# E: Failure(""Command \'\'/Users/walkie/.opam/system/bin/ocamlbuild\' src/eff.native -tag debug\' terminated with error code 10"")\r\n# make: *** [build] Error 1\r\n~~~\r\n\r\nHere\'s the full output of OPAM, which includes the versions of dependencies: [OPAM-Eff.txt](https://github.com/matijapretnar/eff/files/1463609/OPAM-Eff.txt)";0;2;"2017-11-11T09:38:58Z";1182255;3625723
242561679;"Fixing the fork-bomb bug on rlwrap editing wrapper.";"";0;21;"2017-07-13T01:37:58Z";3820407;3625723
218764024;"Choice example";"As mentioned in #22 , this fixes 1 of the examples (choice.eff) to run on the current version of Eff.";0;0;"2017-04-02T13:17:43Z";1749303;3625723
217026884;"Running examples/*.eff";"I built eff from source `./configure && make`, and tried to run the example\r\n\r\n```\r\n$ ./eff examples/choice.eff\r\nSyntax error (file ""examples/choice.eff"", line 6, char 15):\r\n```\r\n\r\nrunning the tests work, and running the example on the interactive tutorial website works as well.\r\n\r\nI\'ve found that the difference is, in the examples effects are declared like so\r\n```\r\ntype \'a random = effect\r\n  operation pick : (\'a * float) list -> \'a\r\nend\r\n```\r\nwhereas the tests have\r\n```\r\neffect Decide : unit -> bool;;\r\n```\r\n\r\nDid I miss any step? Thanks!";0;6;"2017-03-26T04:38:35Z";1749303;3625723
196901462;"Are there any ffi/plan on adding ffi?";"";0;4;"2016-12-21T10:47:24Z";3397377;3625723
170800935;"Effect Handlers in OCaml";"Sorry for abusing the issue system for a question. Once effect handlers are implemented in OCaml, would it be possible to simply compile Eff to OCaml Lambda (using, for example, [Malfunction])(https://github.com/stedolan/malfunction), and let the runtime do the rest?\n";0;1;"2016-08-12T05:23:08Z";87875;3625723
118076011;"dead handlers-tutorial.pdf link on home page ";"""Then, to learn more about the theoretical background, you can read [An Introduction to Algebraic Effects and Handlers].""\n\n<a href=""handlers-tutorial.pdf"">An Introduction to Algebraic Effects and Handlers</a>\n\ntia\n\n~A\n";0;1;"2015-11-20T16:26:49Z";909022;3625723
113636446;"Improve README.md";"";0;0;"2015-10-27T17:22:40Z";646599;3625723
84743271;"Does not compile on OS X";"Here is my Opam setup:\n\n```\n$ env | grep opam\nCAML_LD_LIBRARY_PATH=/usr/local/opam/4.01.0/lib/stublibs\nMANPATH=/usr/local/opam/4.01.0/man:\nPERL5LIB=/usr/local/opam/4.01.0/lib/perl5\nOPAMROOT=/usr/local/opam\nOCAML_TOPLEVEL_PATH=/usr/local/opam/4.01.0/lib/toplevel\nPATH=/usr/local/opam/4.01.0/bin:/Library/Frameworks/Python.framework/Versions/3.4/bin:/Users/andrej/bin:/Users/andrej/.cabal/bin:/usr/local/bin:/usr/bin:/bin:/usr/sbin:/sbin:/opt/X11/bin:/usr/local/MacGPG2/bin:/usr/texbin\n```\n\nI am on master branch of Eff, commit 5ad3b545324413765c7d42fa4994fcccfb573c02.\nWhen I run `./configure` it gets wrong the directory in which Ocaml binaries are found:\n\n```\n$ ./configure \nConfiguration: \nocamlfind: ........................................... /usr/local/opam/system/bin/ocamlfind\nocamlc: .............................................. /usr/local/bin/ocamlc.opt\nocamlopt: ............................................ /usr/local/bin/ocamlopt.opt\nocamlbuild: .......................................... /usr/local/bin/ocamlbuild\n```\n\nAnd so compilation fails:\n\n```\n$ make\nocaml setup.ml -build \nFinished, 1 target (0 cached) in 00:00:00.\n/bin/sh: /usr/local/opam/system/bin/ocamlfind: No such file or directory\nFailure: Error while running: /usr/local/opam/system/bin/ocamlfind list.\nCompilation unsuccessful after building 0 targets (0 cached) in 00:00:00.\nE: Failure(""Command \'\'/usr/local/bin/ocamlbuild\' src/eff.native -tag debug\' terminated with error code 2"")\nmake: *** [build] Error 1\n```\n";0;2;"2015-06-03T19:51:21Z";646599;3625723
84623678;"Incorrect type inference for = ?";"Equality does not imply the inequality of the types of the expressions that are compared.\n\neg the inferred type of\n\n```\nlet f x y = x = y\n```\n\nis a -> b -> bool instead of a -> a -> bool\n";0;5;"2015-06-03T15:33:08Z";37965;3625723
64873309;"Add an OPAM file for eff.";"This should makes the installation instructions a little simpler.  Once you have OPAM installed you can switch to a suitable OCaml compiler (`opam switch 4.02.1`) and then run\n\n```\nopam pin add eff git@github.com:matijapretnar/eff.git\n```\n\nto download the dependencies and build and install eff.\n";0;8;"2015-03-27T23:46:28Z";1736496;3625723
64685186;"how to get dev environment setup?";"Eff looks really cool, very excited to check it out. Trying to get it building locally on OSX by following the README, but running into an issue:\n\n```\n$ ./configure\nE: Field 'findlib_version' is not set: Field 'ocamlfind' is not set\n```\n\nHow do you set those variables? Google didn't give anything, though https://ocaml.org/docs/install.html#Debian shows:\n\n```\napt-get install ocaml-findlib\n```\n\nIs it required to install `findlib` on the Mac? How did you get it working, are you running on Linux or a Mac?\n\nI got ocaml setup with homebrew:\n\n```\n$ brew install ocaml\n$ brew install opam\n$ brew install menhir\n$ ocaml -version\nThe OCaml toplevel, version 4.02.1\n```\n\nAny ideas?\n";0;4;"2015-03-27T03:37:05Z";28718;3625723
44231072;"missing tutorial style like updated introduction";"There is no tutorial/overview comparing the advantages of eff to other ways of describing IO in Ocaml. This would be helpful to discuss the advantages.\n";0;3;"2014-09-28T13:52:49Z";6884591;3625723
24741134;"Replace deprecated `or` with `||`";"Ocaml 4.01.0 whines about `or` and wants it replaced with `||`.\n";0;0;"2013-12-24T09:45:07Z";646599;3625723
20901179;"Occurs check needed";"Expressions with (what would be) recursive types cause the type checker to loop, e.g.\n\n``` ocaml\n#type let rec f x = f in f;;\n```\n";0;3;"2013-10-11T23:50:57Z";1736496;3625723
12967215;"Eff 3.0 hangs on handlers which handle invalid operations";"If in pervasives.eff we do this (notice `r#print _ k`):\n\n```\nlet state r x = handler\n  | val y -> (fun _ -> y)\n  | r#print _ k -> (fun s -> k s s)\n  | r#update s' k -> (fun _ -> k () s')\n  | finally f -> f x;;\n```\n\nthen eff 3.0 hangs.\n";0;1;"2013-04-09T11:35:43Z";646599;3625723
6115560;"Tctx functions use global context, pattern exhaust only after infer, merged";"As it turns out, all calls to Tctx.xxxx explicitly passed !Tctx.global, so we might as well use !Tctx.global directly and avoid passing it.\n\nPattern exhaustion is now performed only after infer succeeds, as it should be.\n\nMerged with upstream.\n";0;0;"2012-08-08T22:55:56Z";646599;3625723
6105409;"Checking for non-exhaustive patterns now done only after the inference phase.";"All calls to Tctx.xxx passed !Tctx.global, so I removed the explicit passing of typing contexts.\nThis means we cannot reason easily in a hypothetical typing context without doing some dirty\nwork, such as temporarily setting Tctx.global. But this should not create trouble, and the\ncode is now cleaner.\n\nPattern exhaustion checking in match statements and checking of irrefutable patterns in\nlet statements is now done properly after inference succeeds. There might be some uneccesarry\nwarning regarding the empty type, but this should not create problems in practice.\n";0;0;"2012-08-08T15:24:58Z";646599;3625723
6091736;"Reinstated lost functionality";"Review code, and put back in functionality which got deleted:\n1. Checks for shadowing of record field labels, constructors and operations. This MUST be done because without such checks we break type safety (the interpreter uses the names at runtime, so when they get shadowed, it finds the wrong ones).\n2. Big_int is back, it is just sooo uncool not to have arbitrary-size integers in the 3rd millenium. Also, removing Big_int did not solve any problems. Even with int we cannot use ocaml = and < for comparison because operation instances need custom comparisons.\n\nI also made ?pos mandatory in error reporting (so now it is ~pos). This works well, except for runtime errors, where it would be better not to have a position reported at all.\n\nPattern exhaustive checks are done badly. They should not be done inside infer, but _after_ infer. This still needs fixed.\n";0;0;"2012-08-07T23:25:03Z";646599;3625723
4436123;"Warnings for pattern matching";"Add checks for useless patterns and non-exhaustive pattern lists in match and let expressions. Common.uniq should be fixed to work for lists of big_ints before this is accepted.\n";0;0;"2012-05-05T11:55:31Z";10137;3625723
3624194;"Got rid of the shell wrapper, better autoconf";"The shell wrapper which looked for rlwrap and ledit is gone, now\neff does this by itself, but only if the interactive shell is\nstarted. Should eff report that a line editor was found?\n\nMakefile.am now declares the eff executable as the main target\n(rather than the shell wrapper), as it should. The trick with\nsettting eff_SOURCES to the empty value is needed, orelse automake\nthinks eff is a C program and wants a C compiler.\n";0;0;"2012-03-13T05:21:48Z";646599;3625723
3603665;"Cleaned up examples directory, added info on editor support, messed with git (sorry)";"";0;0;"2012-03-11T21:28:35Z";646599;3625723
3591783;"Changes to how exceptions are organized in pervasives, better example, changes to how toplevel results are printed";"";0;0;"2012-03-09T23:52:30Z";646599;3625723
3562053;"Link to eff page in README";"";0;0;"2012-03-08T12:31:48Z";646599;3625723
3544513;"Testing pull requests";"I have never made a pull request in my life, so here is an easy test case.\n";0;0;"2012-03-07T15:33:45Z";646599;3625723
776115856;"Npaka z zaganjanjem binderja";"Pri zaganjanju binderja imaš težavo, saj nisi spremenil imena in emaila v gitconfigu. Poiskusi s tem, če odpravi težavo. \r\n\r\n`\r\n# Vstavi svoje podatke za git, da bo mogoča uporaba v Binderju\r\n[user]\r\n\tname = Matej Rojec\r\n\temail = matej.4001@gmail.com\r\n`\r\n";0;0;"2020-12-29T22:32:49Z";64776159;298123563
736737567;"Posodobitev";"";0;0;"2020-11-05T08:50:41Z";57100714;298123563
736693833;"Nič še ne deluje!";"* Začni *delo* na **projektu**!\r\n```R\r\nx <- y + z\r\ncat(x, y)\r\n```";0;1;"2020-11-05T07:43:32Z";6708236;298123563
1107131183;"Predgovor";"Sedaj imajo vse naloge v zbirki napisane rešitve, tako da manjka samo še predgovor, ki bo vključen v tem pull requestu. V njem se zahvalim tudi študentom, ki ste prispevali rešitve in popravke: @Babnik21, @evadezelak, @larajagodnik, @mperbil, @RenkoT97, @MatejRojec, @juresternad, @zalastopar, @kuco23, @AnjaTrobec in @JanSifrer. Če ima kdo kakršnekoli pripombe ali predloge, mi jih lahko sporočite tukaj ali po e-pošti.";0;1;"2022-01-18T16:43:36Z";6708236;174718101
1090201941;"Še en odvečen stavek";"";0;0;"2021-12-29T00:52:38Z";6708236;174718101
1090197010;"Odstranjeno odvečno besedilo";"";0;0;"2021-12-29T00:40:15Z";6708236;174718101
1090192267;"Vse naloge so rešene";"";0;0;"2021-12-29T00:25:58Z";6708236;174718101
1088600390;"Resitve nalog iz algoritmov na grafih";"Še zadnji sklop rešitev nalog.";0;0;"2021-12-25T13:14:00Z";6708236;174718101
923865827;"Napaka v rešitvi naloge 3.11";"Na koncu rešitve je podan postopek odločanja: \r\n\r\n• Če je 0 ≤ p < 3/22, se odločimo za pot preko vozlišča C v list z vrednostjo 0.\r\n• Če je 1/7  ≤ p < 3/22, se odločimo za pot preko vozlišča B.\r\n\r\nMislim, da je v drugem primeru pravi interval: 3/22 ≤  p ≤ 1/4.";0;1;"2021-06-17T12:26:27Z";64798112;174718101
920615145;"Napaka v rešitvi pri nalogi 2.7";"V rešitvi je kot iskana vrednost naveden maksimum vsote samo po i-jih: $max(\\sum_{i=1}^{12} j p_{ij} x_{ij}$). Mislim, da bi morala biti vključena še vsota po j-jih: $max(\\sum_{i=1}^{12} (\\sum_{j=1}^3 j p_{ij} x_{ij}))$.\r\n\r\nPrav tako ni naveden pogoj:$\\forall i = 1, \\dots, 12, \\forall j = 1, 2, 3: 0 \\le x_{ij} \\le 1, x_{ij} \\in \\mathbb{Z}$";0;1;"2021-06-14T17:14:46Z";64798112;174718101
912294342;"Naloge iz 2. kolokvija in 1. izpita 2021";"";0;0;"2021-06-05T14:44:05Z";6708236;174718101
910730199;"Resitev naloge 5.27";"";0;3;"2021-06-03T17:54:10Z";64798112;174718101
909735379;"Napaka v tabeli pri nalogi 6.3";"V rešitvah je pri nalogi 6.3 v tabeli 35 v drugi vrstici (najprej) pri vozlišču a indeks b. Mislim, da bi ustrezen indeks moral biti c.";0;1;"2021-06-02T17:39:59Z";64798112;174718101
908317042;"Napaka v navodilu";"Pri nalogi 5.43 je napak v navodilu. \r\nV _Tabela 2: Podatki za nalogo 5.43._ je za predmet (oznako) _h_ zadosten pogoj narobe naveden, predmet _h_ je zadosten pogoj za _h_, kar je malo nesmiselno. Vrjetno bi moral biti zadosten pogoj za _g_, saj tako dobim enak rezultat kot je v rešitvah.";0;1;"2021-06-01T13:51:47Z";64697421;174718101
907612587;"resitev";"#5 Naloga 27";0;1;"2021-05-31T16:56:50Z";64798112;174718101
892657551;"Naloga iz Floyd-Warshallovega algoritma";"";0;0;"2021-05-16T12:07:43Z";6708236;174718101
875356958;"Naloge iz 1. kolokvija 2021";"";0;0;"2021-05-04T11:13:23Z";6708236;174718101
855288218;"Popravek pri nalogi 2.17";"Zdi se mi, da bi morali biti pogoji za spremenljivke $x_i$,$y_i$,$z_i$ podani takole:\r\n$\\forall i \\in \\{ 1,...,n \\} : x_i \\geq 0 , x_i \\in \\mathbb{Z}$,\r\neanko potem tudi za $y_i$ in $z_i$. ";0;1;"2021-04-11T11:56:47Z";64556640;174718101
807942964;"Študijsko gradivo iz Operacijskih raziskav";"TODO:\r\n\r\n- [x] avtorske pravice/licenca\r\n- [x] CIP/ISBN";0;1;"2021-02-14T11:36:37Z";6708236;174718101
784990224;"Rešitve ""teoretičnih"" grafovskih nalog";"";0;0;"2021-01-13T10:40:14Z";6708236;174718101
775051174;"Rešitve nalog iz dinamičnega programiranja, tretjič";"Še zadnji sklop rešitev nalog iz dinamičnega programiranja.";0;0;"2020-12-27T14:49:37Z";6708236;174718101
688415457;"Rešitve ""prevozniških"" nalog";"";0;0;"2020-08-29T00:09:48Z";6708236;174718101
686344435;"Rešitve nalog iz dinamičnega programiranja, drugič";"Še nekaj nalog, bolj teoretičnih in z zaporedji/nizi.";0;0;"2020-08-26T13:58:48Z";6708236;174718101
672396559;"Rešitve nalog iz dinamičnega programiranja";"";0;0;"2020-08-03T23:16:09Z";6708236;174718101
671596122;"Rešitev nalog 4.15 in 4.16";"Bom preveril, kako izgleda, preden pridružim.";0;0;"2020-08-02T11:01:50Z";6708236;174718101
650957267;"Dodala sem rešitev naloge 6.8";"Tokrat iz prave veje.";0;2;"2020-07-04T21:14:31Z";45061263;174718101
650951526;"Dodala sem rešitev naloge 6.8";"";0;1;"2020-07-04T20:30:28Z";45061263;174718101
638158739;"3.22.";"Pozdravljeni,\r\npošiljam nalogo 3.22.. Upam, da je napisana pravilno.\r\nLep pozdrav,\r\nMaks Perbil";0;3;"2020-06-13T13:04:10Z";49915442;174718101
637127046;"Resitev naloge 6.10";"Pozdravljeni,\r\n\r\npošiljam rešitev naloge 6.10.\r\n\r\nLP,\r\nJan";0;1;"2020-06-11T15:40:34Z";39694987;174718101
637120210;"Rešitev naloge 6.10.";"Pozdravljeni, \r\n\r\npošiljam rešitev naloge.\r\n\r\nLP,\r\nJan";0;0;"2020-06-11T15:34:29Z";39694987;174718101
619689565;"Resitev naloge 3.28";"Pozdravljeni,\r\nNapisal sem rešitev za nalogo 3.28. `judo`. Upam da je rešitev pravilno napisana.\r\n\r\nLepo pozdravljeni,\r\nJan Šifrer";0;1;"2020-05-17T12:24:58Z";39694987;174718101
